{
    "name": "pressureArrange",
    "description": "pressureArrange",
    "concurrentNum": 2,
    "steps": [
        {
            "type": "loop",
            "mode": "concurrent",
            "control": {
                "name": "healthCheck",
                "key": {
                    "from": "literal",
                    "content": "10080"
                },
                "steps": [
                    {
                        "type": "api",
                        "mode": "normal",
                        "api": {
                            "name": "healthCheck",
                            "command": "scheduleApi",
                            "args": [
                                {
                                    "name": "name",
                                    "value": {
                                        "from": "literal",
                                        "content": "healthCheck"
                                    }
                                }
                            ]
                        }
                    },
                    {
                        "type": "api",
                        "mode": "normal",
                        "api": {
                            "name": "pressureSleep",
                            "command": "pressureSleep",
                            "args": [
                                {
                                    "name": "hour",
                                    "value": {
                                        "from": "literal",
                                        "content": "0"
                                    }
                                },
                                {
                                    "name": "minute",
                                    "value": {
                                        "from": "literal",
                                        "content": "1"
                                    }
                                },
                                {
                                    "name": "second",
                                    "value": {
                                        "from": "literal",
                                        "content": "0"
                                    }
                                }
                            ]
                        }
                    }
                ]
            }
        },
        {
            "type": "loop",
            "mode": "concurrent",
            "control": {
                "name": "pressureTest",
                "key": {
                    "from": "literal",
                    "content": "336"
                },
                "steps": [
                    {
                        "type": "api",
                        "mode": "normal",
                        "api": {
                            "name": "pressureTest",
                            "command": "scheduleApi",
                            "args": [
                                {
                                    "name": "name",
                                    "value": {
                                        "from": "literal",
                                        "content": "pressureTest"
                                    }
                                }
                            ]
                        }
                    },
                    {
                        "type": "api",
                        "mode": "normal",
                        "api": {
                            "name": "pressureSleep",
                            "command": "pressureSleep",
                            "args": [
                                {
                                    "name": "hour",
                                    "value": {
                                        "from": "literal",
                                        "content": "0"
                                    }
                                },
                                {
                                    "name": "minute",
                                    "value": {
                                        "from": "literal",
                                        "content": "30"
                                    }
                                },
                                {
                                    "name": "second",
                                    "value": {
                                        "from": "literal",
                                        "content": "0"
                                    }
                                }
                            ]
                        }
                    }
                ]
            }
        }
    ]
}